{
  "page": "about",
  "path": "/about",
  "templatePath": "about.hbs",
  "navActive": "/about",
  "pageCss": "about",
  "meta": {
    "title": "五格について — 赤ちゃん名前診断",
    "description": "姓名判断の基本「五格」の仕組みを分かりやすく解説。天格・人格・地格・外格・総格それぞれの意味と計算方法をご紹介します。",
    "og": {
      "title": "五格について — 赤ちゃん名前診断",
      "description": "姓名判断の基本「五格」の仕組みを分かりやすく解説します。",
      "type": "article",
      "image": "/assets/images/og-image.png"
    }
  },
  "jsonLd": {
    "@context": "https://schema.org",
    "@type": "Article",
    "headline": "五格について — 姓名判断の基本を解説",
    "description": "姓名判断の五格（天格・人格・地格・外格・総格）の計算方法と意味を解説",
    "author": {
      "@type": "Organization",
      "name": "赤ちゃん名前診断"
    }
  }
}
